{
  "preset_id": "commerce--bold-confident",
  "source_project": "drop",
  "seeds": [
    {
      "url": "https://www.nike.com",
      "kind": "visual-reference",
      "title": "Nike",
      "notes": "bold streetwear commerce references"
    },
    {
      "url": "https://www.supremenewyork.com",
      "kind": "visual-reference",
      "title": "Supreme",
      "notes": "drop commerce + lookbook references"
    },
    {
      "url": "https://kith.com",
      "kind": "visual-reference",
      "title": "Kith",
      "notes": "bold product detail + drop banner references"
    },
    {
      "url": "https://www.ssense.com",
      "kind": "visual-reference",
      "title": "SSENSE",
      "notes": "commerce checkout flow references"
    },
    {
      "url": "https://www.musinsa.com",
      "kind": "visual-reference",
      "title": "Musinsa",
      "notes": "KR streetwear commerce references"
    },
    {
      "url": "https://www.29cm.co.kr",
      "kind": "visual-reference",
      "title": "29CM",
      "notes": "KR bold product detail references"
    }
  ],
  "pretendard_font_license": "SIL OFL 1.1",
  "created_at": "2026-04-21T12:34:59Z"
}
