{
  "preset_id": "dashboard--bold-confident",
  "source_project": "lattice-dash",
  "seeds": [
    {
      "url": "https://retool.com",
      "kind": "design-system",
      "title": "Retool",
      "notes": "internal tool admin console references (data-table · filter · KPI)"
    },
    {
      "url": "https://www.appsmith.com",
      "kind": "design-system",
      "title": "Appsmith",
      "notes": "open-source admin builder references (sidebar-nav · query list)"
    },
    {
      "url": "https://stripe.com/radar",
      "kind": "design-system",
      "title": "Stripe Radar",
      "notes": "fraud admin dashboard references (alert list · ticket queue · data-table)"
    },
    {
      "url": "https://posthog.com",
      "kind": "design-system",
      "title": "PostHog",
      "notes": "product analytics references (activation funnel · cohort matrix · retention)"
    },
    {
      "url": "https://plausible.io",
      "kind": "design-system",
      "title": "Plausible",
      "notes": "lightweight analytics admin references (KPI · segment filter)"
    },
    {
      "url": "https://mixpanel.com",
      "kind": "design-system",
      "title": "Mixpanel",
      "notes": "cohort retention matrix + funnel references"
    }
  ],
  "pretendard_font_license": "SIL OFL 1.1",
  "created_at": "2026-04-21T12:34:59Z"
}
