{
  "preset_id": "document-content--minimal-tech",
  "source_project": "lattice",
  "seeds": [
    {
      "url": "https://linear.app/docs",
      "kind": "reference-docs",
      "title": "Linear Docs",
      "notes": "minimal developer docs reference layout"
    },
    {
      "url": "https://docs.stripe.com",
      "kind": "reference-docs",
      "title": "Stripe Docs",
      "notes": "API reference + callout / code block references"
    },
    {
      "url": "https://vercel.com/docs",
      "kind": "reference-docs",
      "title": "Vercel Docs",
      "notes": "minimal devtools docs references"
    },
    {
      "url": "https://developer.mozilla.org",
      "kind": "reference-docs",
      "title": "MDN Web Docs",
      "notes": "comprehensive API reference UI"
    }
  ],
  "pretendard_font_license": "SIL OFL 1.1",
  "created_at": "2026-04-21T12:34:59Z"
}
