{
  "preset_id": "dashboard--minimal-tech",
  "source_project": "orbit",
  "seeds": [
    {
      "url": "https://linear.app",
      "kind": "design-system",
      "title": "Linear",
      "notes": "minimal SaaS admin references (sidebar, command palette, kanban)"
    },
    {
      "url": "https://height.app",
      "kind": "design-system",
      "title": "Height",
      "notes": "issue tracker / dashboard density references"
    },
    {
      "url": "https://www.notion.so",
      "kind": "design-system",
      "title": "Notion",
      "notes": "workspace navigation + database UI references"
    }
  ],
  "pretendard_font_license": "SIL OFL 1.1",
  "created_at": "2026-07-08T07:25:26Z"
}
